<?xml version="1.0" encoding="UTF-8"?>
<kernel ver="0.18" xmlns="http://tritonn.ru" xmlns:xsi="http://www.w3.org/2001/XMLSchema-instance" xsi:schemaLocation="http://tritonn.ru ./kernel.xsd">
<!--
	System variables
-->
<sysvars>
	<values>
		<value name="system.version.major" type="USINT" readonly="1" loadable="0" unit="512" access="0x80000000"/>
		<value name="system.version.minor" type="USINT" readonly="1" loadable="0" unit="512" access="0x80000000"/>
		<value name="system.version.build" type="UINT" readonly="1" loadable="0" unit="512" access="0x80000000"/>
		<value name="system.version.hash" type="UDINT" readonly="1" loadable="0" unit="512" access="0x80000000"/>
		<value name="system.version.crc" type="UDINT" readonly="1" loadable="0" unit="512" access="0x80000000"/>
		<value name="system.state.alarm" type="UDINT" readonly="1" loadable="0" unit="512" access="0x80000000"/>
		<value name="system.state.live" type="USINT" readonly="1" loadable="0" unit="512" access="0x80000000"/>
		<value name="system.state.rebootreason" type="USINT" readonly="1" loadable="0" unit="512" access="0x80000000"/>
		<value name="system.state.simulate" type="USINT" readonly="1" loadable="0" unit="512" access="0x00000000"/>
		<value name="system.datetime.sec" type="INT" readonly="1" loadable="0" unit="512" access="0x00000000"/>
		<value name="system.datetime.min" type="INT" readonly="1" loadable="0" unit="512" access="0x00000000"/>
		<value name="system.datetime.hour" type="INT" readonly="1" loadable="0" unit="512" access="0x00000000"/>
		<value name="system.datetime.day" type="INT" readonly="1" loadable="0" unit="512" access="0x00000000"/>
		<value name="system.datetime.month" type="INT" readonly="1" loadable="0" unit="512" access="0x00000000"/>
		<value name="system.datetime.year" type="INT" readonly="1" loadable="0" unit="512" access="0x00000000"/>
		<value name="system.datetime.set.sec" type="INT" readonly="0" loadable="0" unit="512" access="0x00020000"/>
		<value name="system.datetime.set.min" type="INT" readonly="0" loadable="0" unit="512" access="0x00020000"/>
		<value name="system.datetime.set.hour" type="INT" readonly="0" loadable="0" unit="512" access="0x00020000"/>
		<value name="system.datetime.set.day" type="INT" readonly="0" loadable="0" unit="512" access="0x00020000"/>
		<value name="system.datetime.set.month" type="INT" readonly="0" loadable="0" unit="512" access="0x00020000"/>
		<value name="system.datetime.set.year" type="INT" readonly="0" loadable="0" unit="512" access="0x00020000"/>
		<value name="system.datetime.set.accept" type="INT" readonly="0" loadable="0" unit="512" access="0x00020000"/>
	</values>
</sysvars>

<!--
	Переменная
-->
<object name="var" global="true">
	<values>
		<value name="value" type="LREAL" readonly="0" loadable="0" unit="0" access="0x00000000"/>
		<value name="unit" type="STRID" readonly="1" loadable="0" unit="512" access="0x00000000"/>
		<value name="lolo" type="LREAL" readonly="0" loadable="1" unit="0" access="0x00000200"/>
		<value name="lo" type="LREAL" readonly="0" loadable="1" unit="0" access="0x00000200"/>
		<value name="hi" type="LREAL" readonly="0" loadable="1" unit="0" access="0x00000200"/>
		<value name="hihi" type="LREAL" readonly="0" loadable="1" unit="0" access="0x00000200"/>
		<value name="hysteresis" type="LREAL" readonly="0" loadable="1" unit="0" access="0x00000200"/>
		<value name="status" type="UINT" readonly="1" loadable="0" unit="512" access="0x00000000"/>
		<value name="setup" type="UINT" readonly="1" loadable="1" unit="512" access="0x00000200"/>
	</values>
	<inputs>
		<input name="value" unit="0"/>
	</inputs>
	<outputs>
		<output name="value" unit="0" default="1"/>
		<output name="fault" unit="512"/>
	</outputs>
</object>

<!-- 
	IO objects list 
-->
<io_list>
<!--
	Аналоговый сигнал
-->
<io name="ai">
	<values>
		<value name="present.value" type="LREAL" readonly="1" loadable="0" unit="0" access="0x00000000"/>
		<value name="present.unit" type="STRID" readonly="1" loadable="0" unit="512" access="0x00000000"/>
		<value name="present.lolo" type="LREAL" readonly="0" loadable="1" unit="0" access="0x00000200"/>
		<value name="present.lo" type="LREAL" readonly="0" loadable="1" unit="0" access="0x00000200"/>
		<value name="present.hi" type="LREAL" readonly="0" loadable="1" unit="0" access="0x00000200"/>
		<value name="present.hihi" type="LREAL" readonly="0" loadable="1" unit="0" access="0x00000200"/>
		<value name="present.hysteresis" type="LREAL" readonly="0" loadable="1" unit="0" access="0x00000200"/>
		<value name="present.status" type="UINT" readonly="1" loadable="0" unit="512" access="0x00000000"/>
		<value name="present.setup" type="UINT" readonly="1" loadable="1" unit="512" access="0x00000200"/>
		<value name="physical.value" type="LREAL" readonly="1" loadable="0" unit="0" access="0x00000000"/>
		<value name="physical.unit" type="STRID" readonly="1" loadable="0" unit="512" access="0x00000000"/>
		<value name="physical.lolo" type="LREAL" readonly="0" loadable="1" unit="0" access="0x00000200"/>
		<value name="physical.lo" type="LREAL" readonly="0" loadable="1" unit="0" access="0x00000200"/>
		<value name="physical.hi" type="LREAL" readonly="0" loadable="1" unit="0" access="0x00000200"/>
		<value name="physical.hihi" type="LREAL" readonly="0" loadable="1" unit="0" access="0x00000200"/>
		<value name="physical.hysteresis" type="LREAL" readonly="0" loadable="1" unit="0" access="0x00000200"/>
		<value name="physical.status" type="UINT" readonly="1" loadable="0" unit="512" access="0x00000000"/>
		<value name="physical.setup" type="UINT" readonly="1" loadable="1" unit="512" access="0x00000200"/>
		<value name="current.value" type="LREAL" readonly="1" loadable="0" unit="515" access="0x00000000"/>
		<value name="current.unit" type="STRID" readonly="1" loadable="0" unit="512" access="0x00000000"/>
		<value name="current.lolo" type="LREAL" readonly="0" loadable="1" unit="515" access="0x00000200"/>
		<value name="current.lo" type="LREAL" readonly="0" loadable="1" unit="515" access="0x00000200"/>
		<value name="current.hi" type="LREAL" readonly="0" loadable="1" unit="515" access="0x00000200"/>
		<value name="current.hihi" type="LREAL" readonly="0" loadable="1" unit="515" access="0x00000200"/>
		<value name="current.hysteresis" type="LREAL" readonly="0" loadable="1" unit="515" access="0x00000200"/>
		<value name="current.status" type="UINT" readonly="1" loadable="0" unit="512" access="0x00000000"/>
		<value name="current.setup" type="UINT" readonly="1" loadable="1" unit="512" access="0x00000200"/>
		<value name="keypad" type="LREAL" readonly="0" loadable="1" unit="0" access="0x00000800"/>
		<value name="scales.min" type="LREAL" readonly="0" loadable="1" unit="0" access="0x00000400"/>
		<value name="scales.max" type="LREAL" readonly="0" loadable="1" unit="0" access="0x00000400"/>
		<value name="setup" type="UINT" readonly="1" loadable="1" unit="512" access="0x80000000"/>
		<value name="mode" type="UINT" readonly="0" loadable="1" unit="512" access="0x00000800"/>
		<value name="status" type="UINT" readonly="1" loadable="0" unit="512" access="0x00000000"/>
		<value name="fault" type="UDINT" readonly="1" loadable="0" unit="512" access="0x00000000"/>
	</values>
	<outputs>
		<output name="present" unit="0" default="1"/>
		<output name="physical" unit="0"/>
		<output name="current" unit="515"/>
		<output name="fault" unit="512"/>
	</outputs>
</io>
<!--
	Частотно-импульсный сигнал
-->
<io name="counter">
	<values>
		<value name="impulse.value" type="LREAL" readonly="1" loadable="0" unit="514" access="0x00000000"/>
		<value name="impulse.unit" type="STRID" readonly="1" loadable="0" unit="512" access="0x00000000"/>
		<value name="impulse.lolo" type="LREAL" readonly="0" loadable="1" unit="514" access="0x00000200"/>
		<value name="impulse.lo" type="LREAL" readonly="0" loadable="1" unit="514" access="0x00000200"/>
		<value name="impulse.hi" type="LREAL" readonly="0" loadable="1" unit="514" access="0x00000200"/>
		<value name="impulse.hihi" type="LREAL" readonly="0" loadable="1" unit="514" access="0x00000200"/>
		<value name="impulse.hysteresis" type="LREAL" readonly="0" loadable="1" unit="514" access="0x00000200"/>
		<value name="impulse.status" type="UINT" readonly="1" loadable="0" unit="512" access="0x00000000"/>
		<value name="impulse.setup" type="UINT" readonly="1" loadable="1" unit="512" access="0x00000200"/>
		<value name="frequency.value" type="LREAL" readonly="1" loadable="0" unit="192" access="0x00000000"/>
		<value name="frequency.unit" type="STRID" readonly="1" loadable="0" unit="512" access="0x00000000"/>
		<value name="frequency.lolo" type="LREAL" readonly="0" loadable="1" unit="192" access="0x00000200"/>
		<value name="frequency.lo" type="LREAL" readonly="0" loadable="1" unit="192" access="0x00000200"/>
		<value name="frequency.hi" type="LREAL" readonly="0" loadable="1" unit="192" access="0x00000200"/>
		<value name="frequency.hihi" type="LREAL" readonly="0" loadable="1" unit="192" access="0x00000200"/>
		<value name="frequency.hysteresis" type="LREAL" readonly="0" loadable="1" unit="192" access="0x00000200"/>
		<value name="frequency.status" type="UINT" readonly="1" loadable="0" unit="512" access="0x00000000"/>
		<value name="frequency.setup" type="UINT" readonly="1" loadable="1" unit="512" access="0x00000200"/>
		<value name="period.value" type="LREAL" readonly="1" loadable="0" unit="209" access="0x00000000"/>
		<value name="period.unit" type="STRID" readonly="1" loadable="0" unit="512" access="0x00000000"/>
		<value name="period.lolo" type="LREAL" readonly="0" loadable="1" unit="209" access="0x00000200"/>
		<value name="period.lo" type="LREAL" readonly="0" loadable="1" unit="209" access="0x00000200"/>
		<value name="period.hi" type="LREAL" readonly="0" loadable="1" unit="209" access="0x00000200"/>
		<value name="period.hihi" type="LREAL" readonly="0" loadable="1" unit="209" access="0x00000200"/>